{
  "artifact_id": "frp-m26-declared-target-implementation-report",
  "contract_digest": "2cc2a387bd07f16adc370bf5addcbbe9bed109c5bc73f9f0b5ad3f87fb2482f8",
  "diagnostics": {
    "error_count": 0,
    "warning_count": 1,
    "warnings": [
      {
        "classification": "declared_target_package_with_unbound_board_pinout",
        "code": "M26-W01-UNBOUND-BOARD-PINOUT",
        "message": "Warning: No PCF file specified; IO pins will be placed automatically",
        "retained": true,
        "severity": "warning"
      }
    ]
  },
  "evidence_classification": {
    "board_pinout_bound": false,
    "implementation_tool_evidence": true,
    "physical_measurements": false,
    "resource_values_are_tool_derived": true,
    "timing_values_are_tool_derived": true,
    "universal_chip_claim": false
  },
  "implementation": {
    "clocks": [
      {
        "achieved_mhz": 154.2495880126953,
        "clock": "host_clk",
        "constraint_mhz": 10,
        "margin_mhz": 144.2495880126953,
        "status": "PASS"
      },
      {
        "achieved_mhz": 29.93026351928711,
        "clock": "core_clk",
        "constraint_mhz": 8,
        "margin_mhz": 21.93026351928711,
        "status": "PASS"
      }
    ],
    "timing_status": "PASS",
    "utilization": {
      "ICESTORM_LC": {
        "available": 7680,
        "used": 1693
      },
      "ICESTORM_PLL": {
        "available": 2,
        "used": 0
      },
      "ICESTORM_RAM": {
        "available": 32,
        "used": 0
      },
      "SB_GB": {
        "available": 8,
        "used": 7
      },
      "SB_IO": {
        "available": 206,
        "used": 87
      },
      "SB_WARMBOOT": {
        "available": 1,
        "used": 0
      }
    }
  },
  "implementation_result": {
    "constraints": {
      "board_pinout": "unbound",
      "core_clock_mhz": 8,
      "core_period_ns": 125.0,
      "host_clock_mhz": 10,
      "host_period_ns": 100.0,
      "inter_clock_timing_policy": "ignore_rel_clk_for_declared_asynchronous_cdc",
      "io_placement": "automatic_with_explicit_warning",
      "sdc_path": "constraints/m26/frp_m26_ice40_hx8k_ct256.sdc"
    },
    "implementation_result_digest": "12bab248e0ca6669ef962e0106e5269caa5851a0e3d3a94bb9e908d78fea732d",
    "reproducibility": {
      "compared_output_count": 5,
      "matching_output_count": 5,
      "mismatching_output_count": 0,
      "outputs": [
        {
          "byte_identical": true,
          "output_id": "design.json",
          "run_a_bytes": 2616239,
          "run_a_sha256": "e78d7f1ac465f6277fbbc940b66c2fcd7468ee508048c867a93e17d64b88ac35",
          "run_b_bytes": 2616239,
          "run_b_sha256": "e78d7f1ac465f6277fbbc940b66c2fcd7468ee508048c867a93e17d64b88ac35"
        },
        {
          "byte_identical": true,
          "output_id": "stat.json",
          "run_a_bytes": 1368,
          "run_a_sha256": "d849c364f3977c45d8f5adcc78086c6a6f28e41b9be37dc7aadb58718143d1fd",
          "run_b_bytes": 1368,
          "run_b_sha256": "d849c364f3977c45d8f5adcc78086c6a6f28e41b9be37dc7aadb58718143d1fd"
        },
        {
          "byte_identical": true,
          "output_id": "design.asc",
          "run_a_bytes": 3433982,
          "run_a_sha256": "faf8d56ff83dd441118654deb834c84238cce1411f595f54db87f91d7845110b",
          "run_b_bytes": 3433982,
          "run_b_sha256": "faf8d56ff83dd441118654deb834c84238cce1411f595f54db87f91d7845110b"
        },
        {
          "byte_identical": true,
          "output_id": "routed.json",
          "run_a_bytes": 4535938,
          "run_a_sha256": "4fdf5d092ec11602f8a7c32629d7cb8c0ac258562bc30c0774aeafea0f97983e",
          "run_b_bytes": 4535938,
          "run_b_sha256": "4fdf5d092ec11602f8a7c32629d7cb8c0ac258562bc30c0774aeafea0f97983e"
        },
        {
          "byte_identical": true,
          "output_id": "nextpnr_report.json",
          "run_a_bytes": 47504,
          "run_a_sha256": "767f8c8ad6ab2bb50371a287900bc2e5eb83d804940e15680b563ed08412690a",
          "run_b_bytes": 47504,
          "run_b_sha256": "767f8c8ad6ab2bb50371a287900bc2e5eb83d804940e15680b563ed08412690a"
        }
      ],
      "seed": 26,
      "single_threaded": true,
      "status": "PASS"
    },
    "run_count": 2,
    "runs": [
      {
        "diagnostics": {
          "error_count": 0,
          "warning_count": 1,
          "warnings": [
            {
              "classification": "declared_target_package_with_unbound_board_pinout",
              "code": "M26-W01-UNBOUND-BOARD-PINOUT",
              "message": "Warning: No PCF file specified; IO pins will be placed automatically",
              "retained": true,
              "severity": "warning"
            }
          ]
        },
        "implementation": {
          "clocks": [
            {
              "achieved_mhz": 154.2495880126953,
              "clock": "host_clk",
              "constraint_mhz": 10,
              "margin_mhz": 144.2495880126953,
              "status": "PASS"
            },
            {
              "achieved_mhz": 29.93026351928711,
              "clock": "core_clk",
              "constraint_mhz": 8,
              "margin_mhz": 21.93026351928711,
              "status": "PASS"
            }
          ],
          "timing_status": "PASS",
          "utilization": {
            "ICESTORM_LC": {
              "available": 7680,
              "used": 1693
            },
            "ICESTORM_PLL": {
              "available": 2,
              "used": 0
            },
            "ICESTORM_RAM": {
              "available": 32,
              "used": 0
            },
            "SB_GB": {
              "available": 8,
              "used": 7
            },
            "SB_IO": {
              "available": 206,
              "used": 87
            },
            "SB_WARMBOOT": {
              "available": 1,
              "used": 0
            }
          }
        },
        "raw_output_count": 5,
        "raw_outputs": [
          {
            "bytes": 2616239,
            "output_id": "design.json",
            "raw_sha256": "e78d7f1ac465f6277fbbc940b66c2fcd7468ee508048c867a93e17d64b88ac35"
          },
          {
            "bytes": 1368,
            "output_id": "stat.json",
            "raw_sha256": "d849c364f3977c45d8f5adcc78086c6a6f28e41b9be37dc7aadb58718143d1fd"
          },
          {
            "bytes": 3433982,
            "output_id": "design.asc",
            "raw_sha256": "faf8d56ff83dd441118654deb834c84238cce1411f595f54db87f91d7845110b"
          },
          {
            "bytes": 4535938,
            "output_id": "routed.json",
            "raw_sha256": "4fdf5d092ec11602f8a7c32629d7cb8c0ac258562bc30c0774aeafea0f97983e"
          },
          {
            "bytes": 47504,
            "output_id": "nextpnr_report.json",
            "raw_sha256": "767f8c8ad6ab2bb50371a287900bc2e5eb83d804940e15680b563ed08412690a"
          }
        ],
        "run_digest": "202cef09b394c0cd7229927180d1de9912fa7a09c4e5c059f7e7b6bd07f65a51",
        "run_id": "RUN_A",
        "seed": 26,
        "status": "PASS",
        "synthesis": {
          "cell_types": {
            "SB_CARRY": 291,
            "SB_DFFER": 269,
            "SB_DFFR": 215,
            "SB_LUT4": 1389
          },
          "num_cells": 2164,
          "num_port_bits": 87,
          "num_ports": 18
        }
      },
      {
        "diagnostics": {
          "error_count": 0,
          "warning_count": 1,
          "warnings": [
            {
              "classification": "declared_target_package_with_unbound_board_pinout",
              "code": "M26-W01-UNBOUND-BOARD-PINOUT",
              "message": "Warning: No PCF file specified; IO pins will be placed automatically",
              "retained": true,
              "severity": "warning"
            }
          ]
        },
        "implementation": {
          "clocks": [
            {
              "achieved_mhz": 154.2495880126953,
              "clock": "host_clk",
              "constraint_mhz": 10,
              "margin_mhz": 144.2495880126953,
              "status": "PASS"
            },
            {
              "achieved_mhz": 29.93026351928711,
              "clock": "core_clk",
              "constraint_mhz": 8,
              "margin_mhz": 21.93026351928711,
              "status": "PASS"
            }
          ],
          "timing_status": "PASS",
          "utilization": {
            "ICESTORM_LC": {
              "available": 7680,
              "used": 1693
            },
            "ICESTORM_PLL": {
              "available": 2,
              "used": 0
            },
            "ICESTORM_RAM": {
              "available": 32,
              "used": 0
            },
            "SB_GB": {
              "available": 8,
              "used": 7
            },
            "SB_IO": {
              "available": 206,
              "used": 87
            },
            "SB_WARMBOOT": {
              "available": 1,
              "used": 0
            }
          }
        },
        "raw_output_count": 5,
        "raw_outputs": [
          {
            "bytes": 2616239,
            "output_id": "design.json",
            "raw_sha256": "e78d7f1ac465f6277fbbc940b66c2fcd7468ee508048c867a93e17d64b88ac35"
          },
          {
            "bytes": 1368,
            "output_id": "stat.json",
            "raw_sha256": "d849c364f3977c45d8f5adcc78086c6a6f28e41b9be37dc7aadb58718143d1fd"
          },
          {
            "bytes": 3433982,
            "output_id": "design.asc",
            "raw_sha256": "faf8d56ff83dd441118654deb834c84238cce1411f595f54db87f91d7845110b"
          },
          {
            "bytes": 4535938,
            "output_id": "routed.json",
            "raw_sha256": "4fdf5d092ec11602f8a7c32629d7cb8c0ac258562bc30c0774aeafea0f97983e"
          },
          {
            "bytes": 47504,
            "output_id": "nextpnr_report.json",
            "raw_sha256": "767f8c8ad6ab2bb50371a287900bc2e5eb83d804940e15680b563ed08412690a"